{
  "elemento": {
    "nucleo.percentual": 8200,
    "elem.1": 3588
  },
  "loja": {
    "13": 7100,
    "58": 4688
  },
  "marca": {
    "10": 11788
  },
  "cargo": {
    "100": 9200,
    "150": 2588
  },
  "competencia": {
    "2025-08": 0,
    "2025-11": 11788
  },
  "matricula": {
    "MATRIC-422": 141300,
    "MATRIC-517": 133550,
    "MATRIC-603": 120400,
    "MATRIC-718": 96850
  },
  "loja_absoluto": {
    "13": 274850,
    "58": 217250
  },
  "competencia_absoluto": {
    "2025-08": 238900,
    "2025-11": 253200
  }
}
